{
  "case_id": "case_001",
  "created_at": "2026-07-03T03:03:16.238954+00:00",
  "package_path": "publish/upload_package",
  "assets": [
    {
      "name": "final_video.mp4",
      "source": "render/final_video.mp4",
      "size_bytes": 17528030,
      "exists": true,
      "checksum": "95845c78ee33b8888158828d6119cbbb14a491fdb8ead13e0406d6104c66c1aa"
    },
    {
      "name": "title.txt",
      "source": "generated",
      "size_bytes": 51,
      "exists": true
    },
    {
      "name": "description.txt",
      "source": "generated",
      "size_bytes": 368,
      "exists": true
    },
    {
      "name": "tags.txt",
      "source": "generated",
      "size_bytes": 218,
      "exists": true
    },
    {
      "name": "chapters.txt",
      "source": "render/chapters.txt",
      "size_bytes": 231,
      "exists": true,
      "checksum": "d95d3befa6cf57f850af282a3f1a6899454e87a1555d4f8377dd529aad37cd21"
    },
    {
      "name": "thumbnail.png",
      "source": "assets/images/thumbnail.png",
      "size_bytes": 0,
      "exists": false
    },
    {
      "name": "metadata.json",
      "source": "generated",
      "size_bytes": 879,
      "exists": true
    }
  ],
  "metadata": {
    "title": "The Ghost in the Machine: Shadow Protocol Case 001",
    "description": "Elena Vasquez, a brilliant cybersecurity analyst, discovers her identity has been systematically erased and replaced by a ghost from the past. In this premiere episode of Shadow Protocol, we descend into the deep state, digital espionage, and the terrifying reality of a surveillance system that knows you better than you know yourself. Are you who you think you are?",
    "tags": [
      "Shadow Protocol",
      "cybersecurity",
      "thriller",
      "neo-noir",
      "identity theft",
      "surveillance state",
      "conspiracy",
      "mystery",
      "data privacy",
      "digital identity",
      "Elena Vasquez",
      "OmniCorp",
      "Phantom Directive",
      "tech horror",
      "psychological thriller",
      "web series"
    ],
    "visibility": "public",
    "language": "en",
    "category": "Entertainment"
  },
  "warnings": []
}
